{
  "protocol": "afterburner.ui",
  "revision": 1,
  "surfaces": [
    {
      "id": "black-box-observability",
      "kind": "panel",
      "title": "Black Box Observability",
      "requiredCapabilities": ["ui.observability.black-box.sink"]
    }
  ],
  "components": ["panel", "table", "text", "button"],
  "capabilities": ["ui.observability.black-box.sink"],
  "observability": {
    "eventSinks": [
      {
        "id": "black-box.ui.events",
        "extensionId": "black-box",
        "requirement": "optional",
        "capability": "ui.observability.black-box.sink",
        "failureBehavior": "ignore-when-absent"
      }
    ]
  }
}
